<!ELEMENT products (product+)>
<!ELEMENT product (ProductCode, ProductName, ProductQuantity, ProductPrice)>
<!ELEMENT ProductCode (#PCDATA)>
<!ELEMENT ProductName (#PCDATA)>
<!ELEMENT ProductQuantity (#PCDATA)>
<!ELEMENT ProductPrice (#PCDATA)>